업종코드,업종한글명,업종영문명,"국내업체업종
세그먼트코드","국외업체업종
세그먼트코드","SRR
업종코드","SRR
업종명",계층구분
4241,"도장, 도배 및 내장 공사업","Painting, papering and finishing carpentry works",건설업,비제조업,F,Construction,3
42411,도장 공사업,Painting works,건설업,비제조업,F,Construction,4
42412,"도배, 실내장식 및 내장 목공사업","Papering, decorating and finishing carpentry works",건설업,비제조업,F,Construction,4
4242,유리 및 창호 공사업,Glazing works and joinery installation,건설업,비제조업,F,Construction,3
42420,유리 및 창호 공사업,Glazing works and joinery installation,건설업,비제조업,F,Construction,4
4249,기타 건축마무리 공사업,Other building completion and finishing,건설업,비제조업,F,Construction,3
42491,"미장, 타일 및 방수 공사업","Plastering, installing tile and waterproofing works",건설업,비제조업,F,Construction,4
42492,건물용 금속공작물 설치 공사업,Installation of metal works used on building,건설업,비제조업,F,Construction,4
42499,그 외 기타 건축 마무리 공사업,Building completion and finishing n.e.c.,건설업,비제조업,F,Construction,4
425,시설물 유지관리 공사업,Repair and maintenance works for construction works and supplementary facilities,건설업,비제조업,F,Construction,2
4250,시설물 유지관리 공사업,Repair and maintenance works for construction works and supplementary facilities,건설업,비제조업,F,Construction,3
42500,시설물 유지관리 공사업,Repair and maintenance works for construction works and supplementary facilities,건설업,비제조업,F,Construction,4
426,건설장비 운영업,Renting of construction machinery and equipment with operator,건설업,비제조업,F,Construction,2
4260,건설장비 운영업,Renting of construction machinery and equipment with operator,건설업,비제조업,F,Construction,3
42600,건설장비 운영업,Renting of construction machinery and equipment with operator,건설업,비제조업,F,Construction,4
45,자동차 및 부품 판매업,Sale of motor vehicles and parts,도소매,비제조업,45,Wholesale and Retail Trade and Repair of Motor Vehicles and Motorcycles,1
451,자동차 판매업,Sale of motor vehicles,도소매,비제조업,45,Wholesale and Retail Trade and Repair of Motor Vehicles and Motorcycles,2
4511,자동차 신품 판매업,Sale of new motor vehicles,도소매,비제조업,45,Wholesale and Retail Trade and Repair of Motor Vehicles and Motorcycles,3
45110,자동차 신품 판매업,Sale of new motor vehicles,도소매,비제조업,45,Wholesale and Retail Trade and Repair of Motor Vehicles and Motorcycles,4
4512,중고 자동차 판매업,Sale of used motor vehicles,도소매,비제조업,45,Wholesale and Retail Trade and Repair of Motor Vehicles and Motorcycles,3
45120,중고 자동차 판매업,Sale of used motor vehicles,도소매,비제조업,45,Wholesale and Retail Trade and Repair of Motor Vehicles and Motorcycles,4
452,자동차 부품 및 내장품 판매업,Sale of motor vehicle parts and accessories,도소매,비제조업,45,Wholesale and Retail Trade and Repair of Motor Vehicles and Motorcycles,2
4521,자동차 신품 부품 및 내장품 판매업,Sale of motor vehicle new parts and accessories,도소매,비제조업,45,Wholesale and Retail Trade and Repair of Motor Vehicles and Motorcycles,3
45211,자동차 신품 타이어 및 튜브 판매업,Sale of motor vehicle new tires and tubes,도소매,비제조업,45,Wholesale and Retail Trade and Repair of Motor Vehicles and Motorcycles,4
45212,자동차용 전용 신품 부품 판매업,Sale of new parts and accessories specialized for motor vehicles,도소매,비제조업,45,Wholesale and Retail Trade and Repair of Motor Vehicles and Motorcycles,4
45213,자동차 내장용 신품 전기.전자. 정밀 기기 판매업,"Sale of new electrical, electronic and precision equipment for motor vehicles",도소매,비제조업,45,Wholesale and Retail Trade and Repair of Motor Vehicles and Motorcycles,4
45219,기타 자동차 신품 부품 및 내장품 판매업,Sale of other new parts and accessories for motor vehicle,도소매,비제조업,45,Wholesale and Retail Trade and Repair of Motor Vehicles and Motorcycles,4
4522,자동차 중고 부품 및 내장품 판매업,Sale of motor vehicle used parts and accessories,도소매,비제조업,45,Wholesale and Retail Trade and Repair of Motor Vehicles and Motorcycles,3
45220,자동차 중고 부품 및 내장품 판매업,Sale of motor vehicle used parts and accessories,도소매,비제조업,45,Wholesale and Retail Trade and Repair of Motor Vehicles and Motorcycles,4
453,모터사이클 및 부품 판매업,Sale of motorcycles and related parts and accessories,도소매,비제조업,45,Wholesale and Retail Trade and Repair of Motor Vehicles and Motorcycles,2
4530,모터사이클 및 부품 판매업,Sale of motorcycles and related parts and accessories,도소매,비제조업,45,Wholesale and Retail Trade and Repair of Motor Vehicles and Motorcycles,3
45301,모터사이클 및 부품 도매업,Wholesale of motorcycles and related parts and accessories,도소매,비제조업,45,Wholesale and Retail Trade and Repair of Motor Vehicles and Motorcycles,4
45302,모터사이클 및 부품 소매업,Retail sale of motorcycles and related parts and accessories,도소매,비제조업,45,Wholesale and Retail Trade and Repair of Motor Vehicles and Motorcycles,4
46,도매 및 상품 중개업,Wholesale trade on own account or on a fee or contract basis ,도소매,비제조업,46,"Wholesale Trade, except of Motor Vehicles and Motorcycles",1
461,상품 중개업,Wholesale on a fee or contract basis ,도소매,비제조업,46,"Wholesale Trade, except of Motor Vehicles and Motorcycles",2
4610,상품 중개업,Wholesale on a fee or contract basis ,도소매,비제조업,46,"Wholesale Trade, except of Motor Vehicles and Motorcycles",3
46101,"산업용 농.축산물, 섬유 원료 및 동물 중개업","Agents involved in the sale of industrial agricultural raw materials, textile raw materials, live animals",도소매,비제조업,46,"Wholesale Trade, except of Motor Vehicles and Motorcycles",4
46102,음ㆍ식료품 및 담배 중개업,"Agents involved in the sale of food, beverages and tobacco",도소매,비제조업,46,"Wholesale Trade, except of Motor Vehicles and Motorcycles",4
46103,"섬유, 의복, 신발 및 가죽제품 중개업","Agents involved in the sale of textiles, clothing, footwear and leather goods",도소매,비제조업,46,"Wholesale Trade, except of Motor Vehicles and Motorcycles",4
46104,목재 및 건축자재 중개업,Agents involved in the sale of timber and building materials,도소매,비제조업,46,"Wholesale Trade, except of Motor Vehicles and Motorcycles",4
46105,"연료, 광물, 1차 금속, 비료 및 화학제품 중개업","Agents involved in the sale of fuels, ores, metals and industrial chemicals including fertilisers",도소매,비제조업,46,"Wholesale Trade, except of Motor Vehicles and Motorcycles",4
46106,기계 및 장비 중개업,Agents involved in the sale of machinery and equipment,도소매,비제조업,46,"Wholesale Trade, except of Motor Vehicles and Motorcycles",4
46107,그 외 기타 특정 상품 중개업,Agents specialized in the sale of other particular products,도소매,비제조업,46,"Wholesale Trade, except of Motor Vehicles and Motorcycles",4
46109,상품 종합 중개업,Agents involved in the sale of a variety of goods,도소매,비제조업,46,"Wholesale Trade, except of Motor Vehicles and Motorcycles",4
462,산업용 농?축산물 및 동?식물 도매업,Wholesale of agricultural raw materials and live animals and plants,도소매,비제조업,46,"Wholesale Trade, except of Motor Vehicles and Motorcycles",2
4620,산업용 농?축산물 및 동?식물 도매업,Wholesale of agricultural raw materials and live animals and plants,도소매,비제조업,46,"Wholesale Trade, except of Motor Vehicles and Motorcycles",3
46201,곡물 및 유지작물 도매업,Wholesale of grains and oilseed crops,도소매,비제조업,46,"Wholesale Trade, except of Motor Vehicles and Motorcycles",4
46202,종자 및 묘목 도매업,Wholesale of seeds and seedlings,도소매,비제조업,46,"Wholesale Trade, except of Motor Vehicles and Motorcycles",4
46203,사료 도매업,Wholesale of animal feeds ,도소매,비제조업,46,"Wholesale Trade, except of Motor Vehicles and Motorcycles",4
46204,화훼류 및 식물 도매업,Wholesale of flowers and plants,도소매,비제조업,46,"Wholesale Trade, except of Motor Vehicles and Motorcycles",4
46205,육지동물 및 반려동물 도매업,Wholesale of live animals and companion animals,도소매,비제조업,46,"Wholesale Trade, except of Motor Vehicles and Motorcycles",4
46209,기타 산업용 농산물 도매업,Wholesale of other agricultural raw materials and live animals and plants,도소매,비제조업,46,"Wholesale Trade, except of Motor Vehicles and Motorcycles",4
463,음ㆍ식료품 및 담배 도매업,"Wholesale of food, beverages and tobaccos",도소매,비제조업,46,"Wholesale Trade, except of Motor Vehicles and Motorcycles",2
4631,신선식품 및 단순 가공식품 도매업,"Wholesale of fresh food and dried, salted and frozen food",도소매,비제조업,46,"Wholesale Trade, except of Motor Vehicles and Motorcycles",3
46311,과실류 도매업,Wholesale of fruit,도소매,비제조업,46,"Wholesale Trade, except of Motor Vehicles and Motorcycles",4
46312,"채소류, 서류 및 향신작물류 도매업","Wholesale of vegetables, root and tube crops and spice crops",도소매,비제조업,46,"Wholesale Trade, except of Motor Vehicles and Motorcycles",4
46313,육류 도매업,Wholesale of meat,도소매,비제조업,46,"Wholesale Trade, except of Motor Vehicles and Motorcycles",4
46314,건어물 및 젓갈류 도매업,Wholesale of dried and salted fishery products,도소매,비제조업,46,"Wholesale Trade, except of Motor Vehicles and Motorcycles",4
46315,"신선, 냉동 및 기타 수산물 도매업","Wholesale of fresh, frozen and other fishery products",도소매,비제조업,46,"Wholesale Trade, except of Motor Vehicles and Motorcycles",4
46319,기타 신선식품 및 단순 가공식품 도매업,"Wholesale of other fresh food and dried, salted and frozen food",도소매,비제조업,46,"Wholesale Trade, except of Motor Vehicles and Motorcycles",4
4632,가공식품 도매업,Wholesale of processed food,도소매,비제조업,46,"Wholesale Trade, except of Motor Vehicles and Motorcycles",3
46321,육류 가공식품 도매업,Wholesale of meat processed food,도소매,비제조업,46,"Wholesale Trade, except of Motor Vehicles and Motorcycles",4
46322,수산물 가공식품 도매업,Wholesale of fishery processed food,도소매,비제조업,46,"Wholesale Trade, except of Motor Vehicles and Motorcycles",4
46323,"빵류, 과자류, 당류, 초콜릿 도매업","Wholesale of bakery, flour confectionery, sugar and chocolate products",도소매,비제조업,46,"Wholesale Trade, except of Motor Vehicles and Motorcycles",4
46324,낙농품 및 동.식물성 유지 도매업,Wholesale of dairy products and edible oils and fats,도소매,비제조업,46,"Wholesale Trade, except of Motor Vehicles and Motorcycles",4
46325,커피 및 차류 도매업,Wholesale of coffee and tea,도소매,비제조업,46,"Wholesale Trade, except of Motor Vehicles and Motorcycles",4
46326,조미료 도매업,Wholesale of condiments and food additive products,도소매,비제조업,46,"Wholesale Trade, except of Motor Vehicles and Motorcycles",4
46329,기타 가공식품 도매업,Wholesale of other processed food,도소매,비제조업,46,"Wholesale Trade, except of Motor Vehicles and Motorcycles",4
4633,음료 및 담배 도매업,Wholesale of beverages and tobaccos,도소매,비제조업,46,"Wholesale Trade, except of Motor Vehicles and Motorcycles",3
46331,주류 도매업,Wholesale of alcoholic beverages,도소매,비제조업,46,"Wholesale Trade, except of Motor Vehicles and Motorcycles",4
46332,비알코올음료 도매업,Wholesale of non-alcoholic beverages,도소매,비제조업,46,"Wholesale Trade, except of Motor Vehicles and Motorcycles",4
46333,담배 도매업,Wholesale of tobaccos,도소매,비제조업,46,"Wholesale Trade, except of Motor Vehicles and Motorcycles",4
464,생활용품 도매업,Wholesale of household goods,도소매,비제조업,46,"Wholesale Trade, except of Motor Vehicles and Motorcycles",2
4641,"생활용 섬유제품, 의복, 의복 액세 서리 및 모피제품 도매업","Wholesale of household textiles, apparels, accessories and fur products",도소매,비제조업,46,"Wholesale Trade, except of Motor Vehicles and Motorcycles",3
46411,생활용 섬유 및 실 도매업,Wholesale of textiles and threads,도소매,비제조업,46,"Wholesale Trade, except of Motor Vehicles and Motorcycles",4
46412,커튼 및 침구용품 도매업,Wholesale of curtains and bedding,도소매,비제조업,46,"Wholesale Trade, except of Motor Vehicles and Motorcycles",4
46413,남녀용 겉옷 및 셔츠 도매업,Wholesale of outerwear and shirts,도소매,비제조업,46,"Wholesale Trade, except of Motor Vehicles and Motorcycles",4
46414,유아용 의류 도매업,Wholesale of babies' garments,도소매,비제조업,46,"Wholesale Trade, except of Motor Vehicles and Motorcycles",4
46415,속옷 및 잠옷 도매업,Wholesale of underwear and nightwear,도소매,비제조업,46,"Wholesale Trade, except of Motor Vehicles and Motorcycles",4
46416,가죽 및 모피제품 도매업,Wholesale of leather and fur products,도소매,비제조업,46,"Wholesale Trade, except of Motor Vehicles and Motorcycles",4
46417,의복 액세서리 및 모조 장신구 도매업,Wholesale of wear accessaries and costume jewellery,도소매,비제조업,46,"Wholesale Trade, except of Motor Vehicles and Motorcycles",4
46419,기타 생활용 섬유 및 직물제품 도매업,Wholesale of other household textiles and textile goods,도소매,비제조업,46,"Wholesale Trade, except of Motor Vehicles and Motorcycles",4
4642,신발 도매업,Wholesale of footwear,도소매,비제조업,46,"Wholesale Trade, except of Motor Vehicles and Motorcycles",3
46420,신발 도매업,Wholesale of footwear,도소매,비제조업,46,"Wholesale Trade, except of Motor Vehicles and Motorcycles",4
4643,"생활용 가구, 조명기구 및 비전기식 생활용 기기 도매업","Wholesale of household furniture, lighting equipment and non-electric appliances ",도소매,비제조업,46,"Wholesale Trade, except of Motor Vehicles and Motorcycles",3
46431,생활용 가구 도매업,Wholesale of household furniture,도소매,비제조업,46,"Wholesale Trade, except of Motor Vehicles and Motorcycles",4
46432,"전구, 램프 및 조명장치 도매업",Wholesale of electric lamps and bulbs and lighting equipment,도소매,비제조업,46,"Wholesale Trade, except of Motor Vehicles and Motorcycles",4
46433,생활용 유리ㆍ요업ㆍ목재ㆍ금속 제품 및 날붙이 도매업,"Wholesale of cutlery and housewares made of glass, ceramic, wood, metal",도소매,비제조업,46,"Wholesale Trade, except of Motor Vehicles and Motorcycles",4
46439,기타 비전기식 생활용 기기 및 기구 도매업,Wholesale of other household non-electric appliances,도소매,비제조업,46,"Wholesale Trade, except of Motor Vehicles and Motorcycles",4
4644,"의약품, 의료용품 및 화장품 도매업",Wholesale of pharmaceutical and medical goods and cosmetics,도소매,비제조업,46,"Wholesale Trade, except of Motor Vehicles and Motorcycles",3
46441,의약품 도매업,Wholesale of pharmaceuticals,도소매,비제조업,46,"Wholesale Trade, except of Motor Vehicles and Motorcycles",4
46442,의료용품 도매업,Wholesale of medical goods,도소매,비제조업,46,"Wholesale Trade, except of Motor Vehicles and Motorcycles",4
46443,화장품 및 화장용품 도매업,Wholesale of cosmetics and related products,도소매,비제조업,46,"Wholesale Trade, except of Motor Vehicles and Motorcycles",4
46444,비누 및 세정제 도매업,Wholesale of soaps and detergents,도소매,비제조업,46,"Wholesale Trade, except of Motor Vehicles and Motorcycles",4
4645,"생활용 포장ㆍ위생용품, 문구용품 및 출판 인쇄물 도매업 ","Wholesale of household wrapping, hygienic goods, stationery and printed publications ",도소매,비제조업,46,"Wholesale Trade, except of Motor Vehicles and Motorcycles",3
46451,"생활용 포장 및 위생용품, 봉투 및 유사 제품 도매업","Wholesale of household wrapping, hygienic goods, bags and similar goods",도소매,비제조업,46,"Wholesale Trade, except of Motor Vehicles and Motorcycles",4
46452,"문구용품, 회화용품, 사무용품 도매업","Wholesale of stationery, artists' goods and office supplies",도소매,비제조업,46,"Wholesale Trade, except of Motor Vehicles and Motorcycles",4
46453,"서적, 잡지 및 기타 인쇄물 도매업","Wholesale of books, magazines and other printed publications",도소매,비제조업,46,"Wholesale Trade, except of Motor Vehicles and Motorcycles",4
4646,"음반 및 비디오물, 악기, 오락 및 경기용품 도매업","Wholesale of music and video recordings, musical instruments, amusement and athletic goods",도소매,비제조업,46,"Wholesale Trade, except of Motor Vehicles and Motorcycles",3
46461,음반 및 비디오물 도매업,Wholesale of music and video recordings,도소매,비제조업,46,"Wholesale Trade, except of Motor Vehicles and Motorcycles",4
46462,악기 도매업,Wholesale of musical instruments,도소매,비제조업,46,"Wholesale Trade, except of Motor Vehicles and Motorcycles",4
46463,"장난감 및 취미, 오락용품 도매업","Wholesale of toys, hobby supplies and game and playthings",도소매,비제조업,46,"Wholesale Trade, except of Motor Vehicles and Motorcycles",4
46464,운동 및 경기용품 도매업,Wholesale of sports and athletic goods,도소매,비제조업,46,"Wholesale Trade, except of Motor Vehicles and Motorcycles",4
46465,자전거 및 기타 운송장비 도매업,Wholesale of bicycles and other transportation equipment,도소매,비제조업,46,"Wholesale Trade, except of Motor Vehicles and Motorcycles",4
4649,"가방, 시계, 안경 및 기타 생활용품 도매업","Wholesale of luggage, watches, eyeglasses and other household goods",도소매,비제조업,46,"Wholesale Trade, except of Motor Vehicles and Motorcycles",3
46491,가방 및 보호용 케이스 도매업,Wholesale of luggage and protective cases,도소매,비제조업,46,"Wholesale Trade, except of Motor Vehicles and Motorcycles",4
46492,시계 및 귀금속제품 도매업,Wholesale of watches and jewellery,도소매,비제조업,46,"Wholesale Trade, except of Motor Vehicles and Motorcycles",4
46493,"안경, 사진장비 및 광학용품 도매업","Wholesale of eyeglasses, photographic equipments and optical goods",도소매,비제조업,46,"Wholesale Trade, except of Motor Vehicles and Motorcycles",4
46499,그 외 기타 생활용품 도매업,Wholesale of other household goods n.e.c.,도소매,비제조업,46,"Wholesale Trade, except of Motor Vehicles and Motorcycles",4
465,기계장비 및 관련 물품 도매업,"Wholesale of machinery, equipment and supplies",도소매,비제조업,46,"Wholesale Trade, except of Motor Vehicles and Motorcycles",2
4651,"컴퓨터 및 주변장치, 소프트웨어 도매업","Wholesale of computers, computer peripheral equipment and software",도소매,비제조업,46,"Wholesale Trade, except of Motor Vehicles and Motorcycles",3
46510,"컴퓨터 및 주변장치, 소프트웨어 도매업","Wholesale of computers, computer peripheral equipment and software",도소매,비제조업,46,"Wholesale Trade, except of Motor Vehicles and Motorcycles",4
4652,"가전제품, 통신장비 및 부품 도매업",Wholesale of electronic and communications equipment and parts,도소매,비제조업,46,"Wholesale Trade, except of Motor Vehicles and Motorcycles",3
46521,가전제품 및 부품 도매업,Wholesale of electronic equipment and parts,도소매,비제조업,46,"Wholesale Trade, except of Motor Vehicles and Motorcycles",4
46522,통신.방송장비 및 부품 도매업,Wholesale of communication and broadcasting apparatuses and parts,도소매,비제조업,46,"Wholesale Trade, except of Motor Vehicles and Motorcycles",4
4653,산업용 기계 및 장비 도매업,Wholesale of industrial machinery and equipment,도소매,비제조업,46,"Wholesale Trade, except of Motor Vehicles and Motorcycles",3
46531,농림업용 기계 및 장비 도매업,Wholesale of agricultural and forestry machinery and equipment,도소매,비제조업,46,"Wholesale Trade, except of Motor Vehicles and Motorcycles",4
46532,건설ㆍ광업용 기계 및 장비 도매업,Wholesale of construction and mining machinery and equipment,도소매,비제조업,46,"Wholesale Trade, except of Motor Vehicles and Motorcycles",4
46533,공작용 기계 및 장비 도매업,Wholesale of machine tools and related equipment,도소매,비제조업,46,"Wholesale Trade, except of Motor Vehicles and Motorcycles",4
46539,기타 산업용 기계 및 장비 도매업,Wholesale of other industrial machinery and equipment,도소매,비제조업,46,"Wholesale Trade, except of Motor Vehicles and Motorcycles",4
4659,기타 기계 및 장비 도매업,Wholesale of other machinery and equipment,도소매,비제조업,46,"Wholesale Trade, except of Motor Vehicles and Motorcycles",3
46591,사무용 가구 및 기기 도매업,Wholesale of office furniture and appliances,도소매,비제조업,46,"Wholesale Trade, except of Motor Vehicles and Motorcycles",4
46592,의료기기 도매업,Wholesale of medical appliances,도소매,비제조업,46,"Wholesale Trade, except of Motor Vehicles and Motorcycles",4
46593,정밀기기 및 과학기기 도매업,Wholesale of precision and scientific instruments and equipment,도소매,비제조업,46,"Wholesale Trade, except of Motor Vehicles and Motorcycles",4
46594,수송용 운송장비 도매업,Wholesale of transport equipment,도소매,비제조업,46,"Wholesale Trade, except of Motor Vehicles and Motorcycles",4
46595,전기용 기계.장비 및 관련 기자재 도매업,Wholesale of electrical machinery and related materials,도소매,비제조업,46,"Wholesale Trade, except of Motor Vehicles and Motorcycles",4
46596,전지 및 케이블 도매업,Wholesale of batteries and cables,도소매,비제조업,46,"Wholesale Trade, except of Motor Vehicles and Motorcycles",4
46599,그 외 기타 기계 및 장비 도매업,Wholesale of other machinery and equipment n.e.c.,도소매,비제조업,46,"Wholesale Trade, except of Motor Vehicles and Motorcycles",4
466,"건축자재, 철물 및 난방장치 도매업","Wholesale of construction materials, hardware and heating and air conditioning equipment",도소매,비제조업,46,"Wholesale Trade, except of Motor Vehicles and Motorcycles",2
4661,일반 건축자재 도매업,Wholesale of construction materials,도소매,비제조업,46,"Wholesale Trade, except of Motor Vehicles and Motorcycles",3
46611,원목 및 건축관련 목제품 도매업,Wholesale of wood and wooden goods for construction industry,도소매,비제조업,46,"Wholesale Trade, except of Motor Vehicles and Motorcycles",4
46612,"골재, 벽돌 및 시멘트 도매업","Wholesale of gravel, bricks and cement",도소매,비제조업,46,"Wholesale Trade, except of Motor Vehicles and Motorcycles",4
46613,유리 및 창호 도매업,"Wholesale of glass, windows and doors",도소매,비제조업,46,"Wholesale Trade, except of Motor Vehicles and Motorcycles",4
4662,"냉?난방장치 및 철물, 수공구 도매업","Wholesale of hardware, handtools and heating and air conditioning equipment",도소매,비제조업,46,"Wholesale Trade, except of Motor Vehicles and Motorcycles",3
46621,배관 및 냉ㆍ난방장치 도매업,Wholesale of plumbing and heating and air conditioning equipment,도소매,비제조업,46,"Wholesale Trade, except of Motor Vehicles and Motorcycles",4
46622,"철물, 금속 파스너 및 수공구 도매업","Wholesale of hardware, metal fastener and handtools",도소매,비제조업,46,"Wholesale Trade, except of Motor Vehicles and Motorcycles",4
4669,기타 건축자재 도매업,Wholesale of other construction materials,도소매,비제조업,46,"Wholesale Trade, except of Motor Vehicles and Motorcycles",3
46691,도료 도매업,Wholesale of paint,도소매,비제조업,46,"Wholesale Trade, except of Motor Vehicles and Motorcycles",4
46692,벽지 및 장판류 도매업,Wholesale of wallpaper and floor coverings,도소매,비제조업,46,"Wholesale Trade, except of Motor Vehicles and Motorcycles",4
46699,그 외 기타 건축자재 도매업,Wholesale of other construction materials n.e.c.,도소매,비제조업,46,"Wholesale Trade, except of Motor Vehicles and Motorcycles",4
467,기타 전문 도매업,Other specialized wholesale,도소매,비제조업,46,"Wholesale Trade, except of Motor Vehicles and Motorcycles",2
4671,"연료, 연료용 광물 및 관련제품 도매업","Wholesale of solid, liquid and gaseous fuels and related products",도소매,비제조업,46,"Wholesale Trade, except of Motor Vehicles and Motorcycles",3
46711,고체연료 및 관련제품 도매업,Wholesale of solid fuels and related products,도소매,비제조업,46,"Wholesale Trade, except of Motor Vehicles and Motorcycles",4
46712,액체연료 및 관련제품 도매업,Wholesale of liquid fuels and related products,도소매,비제조업,46,"Wholesale Trade, except of Motor Vehicles and Motorcycles",4
