업종코드,업종한글명,업종영문명,"국내업체업종
세그먼트코드","국외업체업종
세그먼트코드","SRR
업종코드","SRR
업종명",계층구분
49232,전세버스 운송업,Chartered bus transport,기타,비제조업,49O,Land Transport,4
49233,특수여객자동차 운송업,Hearse transport,기타,비제조업,49O,Land Transport,4
49239,기타 부정기 여객 육상 운송업,Other non-scheduled passenger land transport,기타,비제조업,49O,Land Transport,4
493,도로 화물 운송업,Freight transport by road,기타,비제조업,49O,Land Transport,2
4930,도로 화물 운송업,Freight transport by road,기타,비제조업,49O,Land Transport,3
49301,일반 화물자동차 운송업,General freight trucking by heavy truck,기타,비제조업,49O,Land Transport,4
49302,개인 화물자동차 운송업,Freight transport by one truck,기타,비제조업,49O,Land Transport,4
49309,기타 도로화물 운송업,Other freight transport by road,기타,비제조업,49O,Land Transport,4
494,소화물 전문 운송업,Couriers and messengers activities,기타,비제조업,53,Postal and Courier Activities,2
4940,소화물 전문 운송업,Couriers and messengers activities,기타,비제조업,53,Postal and Courier Activities,3
49401,택배업,Courier activities,기타,비제조업,53,Postal and Courier Activities,4
49402,늘찬 배달업,Local delivery and messenger services,기타,비제조업,53,Postal and Courier Activities,4
495,파이프라인 운송업,Transport via pipeline,기타,비제조업,493,Transport via Pipeline,2
4950,파이프라인 운송업,Transport via pipeline,기타,비제조업,493,Transport via Pipeline,3
49500,파이프라인 운송업,Transport via pipeline,기타,비제조업,493,Transport via Pipeline,4
5,기타[MTI],,,,,,
50,수상 운송업,Water transport,기타,비제조업,50,Water Transport,1
501,해상 운송업,Sea and coastal water transport,기타,비제조업,50,Water Transport,2
5011,외항 운송업,Sea water transport,기타,비제조업,50,Water Transport,3
50111,외항 여객 운송업,Sea passenger water transport,기타,비제조업,50,Water Transport,4
50112,외항 화물 운송업,Sea freight water transport,기타,비제조업,50,Water Transport,4
5012,내항 운송업,Coastal water transport,기타,비제조업,50,Water Transport,3
50121,내항 여객 운송업,Coastal passenger water transport,기타,비제조업,50,Water Transport,4
50122,내항 화물 운송업,Coastal freight water transport,기타,비제조업,50,Water Transport,4
5013,기타 해상 운송업,Other sea and coastal water transport,기타,비제조업,50,Water Transport,3
50130,기타 해상 운송업,Other sea and coastal water transport,기타,비제조업,50,Water Transport,4
502,내륙 수상 및 항만 내 운송업,Inland water transport,기타,비제조업,50,Water Transport,2
5020,내륙 수상 및 항만 내 운송업,Inland water transport,기타,비제조업,50,Water Transport,3
50201,항만 내 여객 운송업,Harbour passenger transport,기타,비제조업,50,Water Transport,4
50209,기타 내륙 수상 여객 및 화물 운송업,Other inland passenger and freight water transport,기타,비제조업,50,Water Transport,4
51,항공 운송업,Air transport,기타,비제조업,51,Air Transport,1
510,기타[MTI],,,,,,
5100,기타[MTI],,,,,,
511,항공 여객 운송업,Passenger air transport,기타,비제조업,51,Air Transport,2
5110,항공 여객 운송업,Passenger air transport,기타,비제조업,51,Air Transport,3
51100,항공 여객 운송업,Passenger air transport,기타,비제조업,51,Air Transport,4
512,항공 화물 운송업,Freight air transport,기타,비제조업,51,Air Transport,2
5120,항공 화물 운송업,Freight air transport,기타,비제조업,51,Air Transport,3
51200,항공 화물 운송업,Freight air transport,기타,비제조업,51,Air Transport,4
52,창고 및 운송관련 서비스업,Warehousing and support activities for transportation,기타,비제조업,52,Warehousing and Support Activities for Transportation,1
520,기타[MTI],,,,,,
5200,기타[MTI],,,,,,
521,보관 및 창고업,Warehousing and storage,기타,비제조업,52,Warehousing and Support Activities for Transportation,2
5210,보관 및 창고업,Warehousing and storage,기타,비제조업,52,Warehousing and Support Activities for Transportation,3
52101,일반 창고업,General warehousing,기타,비제조업,52,Warehousing and Support Activities for Transportation,4
52102,냉장 및 냉동 창고업,Refrigerated and frozen warehousing,기타,비제조업,52,Warehousing and Support Activities for Transportation,4
52103,농산물 창고업,Farm products warehousing,기타,비제조업,52,Warehousing and Support Activities for Transportation,4
52104,위험물품 보관업,Dangerous goods warehousing,기타,비제조업,52,Warehousing and Support Activities for Transportation,4
52109,기타 보관 및 창고업,Other warehousing and storage,기타,비제조업,52,Warehousing and Support Activities for Transportation,4
529,기타 운송관련 서비스업,Support activities for transportation,기타,비제조업,52,Warehousing and Support Activities for Transportation,2
5291,육상 운송지원 서비스업,Service activities incidental to land transportation,기타,비제조업,52,Warehousing and Support Activities for Transportation,3
52911,철도 운송지원 서비스업,Service activities incidental to rail transportation,기타,비제조업,52,Warehousing and Support Activities for Transportation,4
52912,여객 자동차 터미널 운영업,Operation of passenger bus terminal facilities,기타,비제조업,52,Warehousing and Support Activities for Transportation,4
52913,물류 터미널 운영업,Operation of logistics terminal facilities,기타,비제조업,52,Warehousing and Support Activities for Transportation,4
52914,도로 및 관련시설 운영업,Operation of roads and related facilities,기타,비제조업,52,Warehousing and Support Activities for Transportation,4
52915,주차장 운영업,Operation of car park or garage facilities,기타,비제조업,52,Warehousing and Support Activities for Transportation,4
52919,기타 육상 운송지원 서비스업,Other service activities incidental to land transportation,기타,비제조업,52,Warehousing and Support Activities for Transportation,4
5292,수상 운송지원 서비스업,Service activities incidental to water transportation,기타,비제조업,52,Warehousing and Support Activities for Transportation,3
52921,항구 및 기타 해상 터미널 운영업,Operation of harbour and marine terminal facilities,기타,비제조업,52,Warehousing and Support Activities for Transportation,4
52922,선박관리업,Ship management,기타,비제조업,52,Warehousing and Support Activities for Transportation,4
52929,기타 수상 운송지원 서비스업,Other service activities incidental to water transportation,기타,비제조업,52,Warehousing and Support Activities for Transportation,4
5293,항공 운송지원 서비스업,Service activities incidental to air transportation,기타,비제조업,52,Warehousing and Support Activities for Transportation,3
52931,공항 운영업,Operation of airport,기타,비제조업,52,Warehousing and Support Activities for Transportation,4
52939,기타 항공 운송지원 서비스업,Other service activities incidental to air transportation,기타,비제조업,52,Warehousing and Support Activities for Transportation,4
5294,화물 취급업,Cargo handling,기타,비제조업,52,Warehousing and Support Activities for Transportation,3
52941,항공 및 육상 화물 취급업,Air and land cargo handling,기타,비제조업,52,Warehousing and Support Activities for Transportation,4
52942,수상 화물 취급업,Marine cargo handling,기타,비제조업,52,Warehousing and Support Activities for Transportation,4
5299,그 외 기타 운송관련 서비스업,Other support activities for transportation n.e.c.,기타,비제조업,52,Warehousing and Support Activities for Transportation,3
52991,통관 대리 및 관련서비스업,Activities of customs agents and related services,기타,비제조업,52,Warehousing and Support Activities for Transportation,4
52992,"화물운송 중개, 대리 및 관련 서비스업",Activities of freight forwarders and cargo agents and related services,기타,비제조업,52,Warehousing and Support Activities for Transportation,4
52993,"화물 포장, 검수 및 계량 서비스업","Activities of cargo packing, checking and weighing services",기타,비제조업,52,Warehousing and Support Activities for Transportation,4
52999,그 외 기타 분류 안된 운송 관련 서비스업,Other supporting transport services n.e.c.,기타,비제조업,52,Warehousing and Support Activities for Transportation,4
55,숙박업,Accommodation,기타,비제조업,I,Accommodation and Food Service Activities,1
551,일반 및 생활 숙박시설 운영업,General accommodation and accommodation with cooking facilities,기타,비제조업,I,Accommodation and Food Service Activities,2
5510,일반 및 생활 숙박시설 운영업,General accommodation and accommodation with cooking facilities,기타,비제조업,I,Accommodation and Food Service Activities,3
55101,호텔업,Hotels,기타,비제조업,I,Accommodation and Food Service Activities,4
55102,여관업,Inns,기타,비제조업,I,Accommodation and Food Service Activities,4
55103,휴양콘도 운영업,Resort condominium,기타,비제조업,I,Accommodation and Food Service Activities,4
55104,민박업,Tourist home,기타,비제조업,I,Accommodation and Food Service Activities,4
55105,야영장업,Camping grounds,기타,비제조업,I,Accommodation and Food Service Activities,4
55109,기타 일반 및 생활 숙박시설 운영업,Other general accommodation and provision of accommodation with cooking facilities,기타,비제조업,I,Accommodation and Food Service Activities,4
559,기타 숙박업,Other accommodation,기타,비제조업,I,Accommodation and Food Service Activities,2
5590,기타 숙박업,Other accommodation,기타,비제조업,I,Accommodation and Food Service Activities,3
55901,기숙사 및 고시원 운영업,Dormitory and accommodation for examinee,기타,비제조업,I,Accommodation and Food Service Activities,4
55909,그 외 기타 숙박업,Other accommodation n.e.c.,기타,비제조업,I,Accommodation and Food Service Activities,4
56,음식점 및 주점업,Food and beverage service activities,기타,비제조업,I,Accommodation and Food Service Activities,1
561,음식점업,Restaurants and mobile food service activities,기타,비제조업,I,Accommodation and Food Service Activities,2
5611,한식 음식점업,Korean food restaurants,기타,비제조업,I,Accommodation and Food Service Activities,3
56111,한식 일반 음식점업,General korean food restaurants,기타,비제조업,I,Accommodation and Food Service Activities,4
56112,한식 면요리 전문점,Korean food restaurants specializing in noodle dishes,기타,비제조업,I,Accommodation and Food Service Activities,4
56113,한식 육류요리 전문점,Korean food restaurants specializing in meat dishes,기타,비제조업,I,Accommodation and Food Service Activities,4
56114,한식 해산물요리 전문점,Korean food restaurants specializing in seafood dishes,기타,비제조업,I,Accommodation and Food Service Activities,4
5612,외국식 음식점업,Foreign food restaurants,기타,비제조업,I,Accommodation and Food Service Activities,3
56121,중식 음식점업,Chinese food restaurants,기타,비제조업,I,Accommodation and Food Service Activities,4
56122,일식 음식점업,Japanese food restaurants,기타,비제조업,I,Accommodation and Food Service Activities,4
56123,서양식 음식점업,Western food restaurants,기타,비제조업,I,Accommodation and Food Service Activities,4
56129,기타 외국식 음식점업,Other foreign food restaurants,기타,비제조업,I,Accommodation and Food Service Activities,4
5613,기관 구내식당업,Industrial restaurants,기타,비제조업,I,Accommodation and Food Service Activities,3
56130,기관 구내식당업,Industrial restaurants,기타,비제조업,I,Accommodation and Food Service Activities,4
5614,출장 및 이동 음식점업,Event catering and mobile food service activities,기타,비제조업,I,Accommodation and Food Service Activities,3
56141,출장 음식 서비스업,Event catering,기타,비제조업,I,Accommodation and Food Service Activities,4
56142,이동 음식점업,Mobile food services activities,기타,비제조업,I,Accommodation and Food Service Activities,4
5615,제과점업,Bakeries,기타,비제조업,I,Accommodation and Food Service Activities,3
56150,제과점업,Bakeries,기타,비제조업,I,Accommodation and Food Service Activities,4
5616,"피자, 햄버거 및 치킨 전문점","Pizza, hamburger, chicken and similar food services activities",기타,비제조업,I,Accommodation and Food Service Activities,3
56161,"피자, 햄버거, 샌드위치 및 유사 음식점업","Pizza, hamburger and sandwich eating places and similar food services activities",기타,비제조업,I,Accommodation and Food Service Activities,4
56162,치킨 전문점,Chicken restaurants,기타,비제조업,I,Accommodation and Food Service Activities,4
5619,김밥 및 기타 간이 음식점업,Dried seaweed rolls and other light food restaurants ,기타,비제조업,I,Accommodation and Food Service Activities,3
56191,김밥 및 기타 간이 음식점업,Dried seaweed rolls and other light food restaurants ,기타,비제조업,I,Accommodation and Food Service Activities,4
56199,간이음식 포장 판매 전문점,Take-out light food restaurants,기타,비제조업,I,Accommodation and Food Service Activities,4
562,주점 및 비알코올 음료점업,Drinking places and non-alcoholic beverages places,기타,비제조업,I,Accommodation and Food Service Activities,2
5621,주점업,Drinking places,기타,비제조업,I,Accommodation and Food Service Activities,3
56211,일반 유흥주점업,General amusement and drinking places,기타,비제조업,I,Accommodation and Food Service Activities,4
56212,무도 유흥주점업,Dancing and drinking halls,기타,비제조업,I,Accommodation and Food Service Activities,4
56213,생맥주 전문점,Taphouses,기타,비제조업,I,Accommodation and Food Service Activities,4
56219,기타 주점업,Other drinking places,기타,비제조업,I,Accommodation and Food Service Activities,4
5622,비알코올 음료점업,Non-alcoholic beverages places,기타,비제조업,I,Accommodation and Food Service Activities,3
56221,커피 전문점,Coffee shops,기타,비제조업,I,Accommodation and Food Service Activities,4
56229,기타 비알코올 음료점업,Other non-alcoholic beverages places,기타,비제조업,I,Accommodation and Food Service Activities,4
58,출판업,Publishing activities,기타,비제조업,58,Publishing Activities,1
581,"서적, 잡지 및 기타 인쇄물 출판업","Publishing of books, magazines and other publishing activities",기타,비제조업,58,Publishing Activities,2
5811,서적 출판업,Book publishing,기타,비제조업,58,Publishing Activities,3
58111,교과서 및 학습서적 출판업,Textbook and study book publishing,기타,비제조업,58,Publishing Activities,4
58112,만화 출판업,Comic book publishing,기타,비제조업,58,Publishing Activities,4
58113,일반 서적 출판업,Other book publishing,기타,비제조업,58,Publishing Activities,4
5812,"신문, 잡지 및 정기간행물 출판업","Publishing of newspapers, magazines and periodicals",기타,비제조업,58,Publishing Activities,3
58121,신문 발행업,Publishing of newspapers,기타,비제조업,58,Publishing Activities,4
58122,잡지 및 정기간행물 발행업,Publishing of magazines and periodicals,기타,비제조업,58,Publishing Activities,4
58123,정기 광고간행물 발행업,Publishing of advertising periodicals,기타,비제조업,58,Publishing Activities,4
5819,기타 인쇄물 출판업,Other publishing activities,기타,비제조업,58,Publishing Activities,3
58190,기타 인쇄물 출판업,Other publishing activities,기타,비제조업,58,Publishing Activities,4
582,소프트웨어 개발 및 공급업,Software publishing,기타,비제조업,58,Publishing Activities,2
5821,게임 소프트웨어 개발 및 공급업,Game software publishing,기타,비제조업,58,Publishing Activities,3
58211,유선 온라인 게임 소프트웨어 개발 및 공급업,Online game software publishing,기타,비제조업,58,Publishing Activities,4
58212,모바일 게임 소프트웨어 개발 및 공급업,Mobile game software publishing,기타,비제조업,58,Publishing Activities,4
58219,기타 게임 소프트웨어 개발 및 공급업,Other game software publishing,기타,비제조업,58,Publishing Activities,4
5822,시스템ㆍ응용 소프트웨어 개발 및 공급업,System and application software publishing,기타,비제조업,58,Publishing Activities,3
58221,시스템 소프트웨어 개발 및 공급업,System software publishing,기타,비제조업,58,Publishing Activities,4
58222,응용 소프트웨어 개발 및 공급업,Application software publishing,기타,비제조업,58,Publishing Activities,4
59,영상ㆍ오디오 기록물 제작 및 배급업,"Motion picture, video and television programme production, sound recording and music publishing activities",기타,비제조업,59_60,Audiovisual and Broadcasting,1
591,"영화, 비디오물, 방송프로그램 제작 및 배급업","Motion picture, video and broadcast programme activities",기타,비제조업,59_60,Audiovisual and Broadcasting,2
5911,"영화, 비디오물 및 방송프로그램 제작업","Motion picture, video, broadcast programme production activities ",기타,비제조업,59_60,Audiovisual and Broadcasting,3
59111,일반 영화 및 비디오물 제작업,General motion picture and video production activities ,기타,비제조업,59_60,Audiovisual and Broadcasting,4
59112,애니메이션 영화 및 비디오물 제작업,Animated cartoon and video production,기타,비제조업,59_60,Audiovisual and Broadcasting,4
59113,광고 영화 및 비디오물 제작업,Advertising motion picture and video production,기타,비제조업,59_60,Audiovisual and Broadcasting,4
59114,방송 프로그램 제작업,Broadcasting programme production,기타,비제조업,59_60,Audiovisual and Broadcasting,4
5912,"영화, 비디오물 및 방송프로그램 제작 관련 서비스업","Motion picture, video and broadcasting programme post-production activities",기타,비제조업,59_60,Audiovisual and Broadcasting,3
59120,"영화, 비디오물 및 방송프로그램 제작 관련 서비스업","Motion picture, video and broadcasting programme post-production activities",기타,비제조업,59_60,Audiovisual and Broadcasting,4
5913,"영화, 비디오물 및 방송프로그램 배급업","Motion picture, video and broadcasting programme distribution activities",기타,비제조업,59_60,Audiovisual and Broadcasting,3
59130,"영화, 비디오물 및 방송프로그램 배급업","Motion picture, video and broadcasting programme distribution activities",기타,비제조업,59_60,Audiovisual and Broadcasting,4
5914,영화 및 비디오물 상영업,Motion picture and video projection activities,기타,비제조업,59_60,Audiovisual and Broadcasting,3
59141,영화관 운영업,Motion picture theaters,기타,비제조업,59_60,Audiovisual and Broadcasting,4
59142,비디오물 감상실 운영업,Video projection activities,기타,비제조업,59_60,Audiovisual and Broadcasting,4
592,오디오물 출판 및 원판 녹음업,Sound recording and music publishing activities,기타,비제조업,59_60,Audiovisual and Broadcasting,2
5920,오디오물 출판 및 원판 녹음업,Sound recording and music publishing activities,기타,비제조업,59_60,Audiovisual and Broadcasting,3
59201,음악 및 기타 오디오물 출판업,Music and sound recordings publishing,기타,비제조업,59_60,Audiovisual and Broadcasting,4
59202,녹음시설 운영업,Sound recording service activities ,기타,비제조업,59_60,Audiovisual and Broadcasting,4
6,기타[MTI],,,,,,
60,방송업,Broadcasting activities,기타,비제조업,59_60,Audiovisual and Broadcasting,1
601,라디오 방송업,Radio broadcasting,기타,비제조업,59_60,Audiovisual and Broadcasting,2
6010,라디오 방송업,Radio broadcasting,기타,비제조업,59_60,Audiovisual and Broadcasting,3
60100,라디오 방송업,Radio broadcasting,기타,비제조업,59_60,Audiovisual and Broadcasting,4
602,텔레비전 방송업,Television broadcasting,기타,비제조업,59_60,Audiovisual and Broadcasting,2
6021,지상파 방송업,Terrestrial broadcasting,기타,비제조업,59_60,Audiovisual and Broadcasting,3
60210,지상파 방송업,Terrestrial broadcasting,기타,비제조업,59_60,Audiovisual and Broadcasting,4
6022,"유선, 위성 및 기타 방송업","Cable, satellite and other broadcasting",기타,비제조업,59_60,Audiovisual and Broadcasting,3
60221,프로그램 공급업,Broadcasting programme provider,기타,비제조업,59_60,Audiovisual and Broadcasting,4
60222,유선 방송업,Cable broadcasting,기타,비제조업,59_60,Audiovisual and Broadcasting,4
60229,위성 및 기타 방송업,Satellite and other broadcasting,기타,비제조업,59_60,Audiovisual and Broadcasting,4
603,영상·오디오물 제공 서비스업,Video and audio distribution activities,기타,비제조업,59_60,Audiovisual and Broadcasting,2
6031,영상물 제공 서비스업,Video distribution activities,기타,비제조업,59_60,Audiovisual and Broadcasting,3
60310,영상물 제공 서비스업,Video distribution activities,기타,비제조업,59_60,Audiovisual and Broadcasting,4
6032,오디오물 제공 서비스업,Audio distribution activities,기타,비제조업,59_60,Audiovisual and Broadcasting,3
60320,오디오물 제공 서비스업,Audio distribution activities,기타,비제조업,59_60,Audiovisual and Broadcasting,4
61,우편 및 통신업,Postal activities and telecommunications,기타,비제조업,61,Telecommunications,1
610,기타[MTI],,,,,,
6100,기타[MTI],,,,,,
611,공영 우편업,Postal activities,기타,비제조업,53,Postal and Courier Activities,2
6110,공영 우편업,Postal activities,기타,비제조업,53,Postal and Courier Activities,3
61100,공영 우편업,Postal activities,기타,비제조업,53,Postal and Courier Activities,4
612,전기 통신업,Telecommunications,기타,비제조업,61,Telecommunications,2
6121,유선 통신업,Wired telecommunications,기타,비제조업,61,Telecommunications,3
61210,유선 통신업,Wired telecommunications,기타,비제조업,61,Telecommunications,4
6122,무선 및 위성 통신업,Wireless and satellite telecommunications,기타,비제조업,61,Telecommunications,3
61220,무선 및 위성 통신업,Wireless and satellite telecommunications,기타,비제조업,61,Telecommunications,4
6129,기타 전기 통신업,Other telecommunications,기타,비제조업,61,Telecommunications,3
61291,통신 재판매업,Telecommunications resellers,기타,비제조업,61,Telecommunications,4
61299,그 외 기타 전기 통신업,Other telecommunications n.e.c.,기타,비제조업,61,Telecommunications,4
62,"컴퓨터 프로그래밍, 시스템 통합 및 관리업","Computer programming, consultancy and related activities ",기타,비제조업,62_63,IT and Information Services,1
620,"컴퓨터 프로그래밍, 시스템 통합 및 관리업","Computer programming, consultancy and related activities ",기타,비제조업,62_63,IT and Information Services,2
6200,기타[MTI],,,,,,
6201,컴퓨터 프로그래밍 서비스업,Computer programming services,기타,비제조업,62_63,IT and Information Services,3
62010,컴퓨터 프로그래밍 서비스업,Computer programming services,기타,비제조업,62_63,IT and Information Services,4
6202,"컴퓨터시스템 통합 자문, 구축 및 관리업",Computer system consultancy and computer facilities management activities,기타,비제조업,62_63,IT and Information Services,3
62021,컴퓨터시스템 통합 자문 및 구축 서비스업,Computer system consultancy activities,기타,비제조업,62_63,IT and Information Services,4
62022,컴퓨터시설 관리업,Computer facilities management services,기타,비제조업,62_63,IT and Information Services,4
6209,기타 정보기술 및 컴퓨터운영 관련 서비스업,Other information technology and computer service activities,기타,비제조업,62_63,IT and Information Services,3
62090,기타 정보기술 및 컴퓨터운영 관련 서비스업,Other information technology and computer service activities,기타,비제조업,62_63,IT and Information Services,4
63,정보서비스업,Information service activities,기타,비제조업,62_63,IT and Information Services,1
631,"자료처리, 호스팅, 포털 및 기타 인터넷 정보매개 서비스업","Data processing, hosting and related activities; web portals",기타,비제조업,62_63,IT and Information Services,2
6311,"자료처리, 호스팅 및 관련 서비스업","Data processing, hosting and related activities",기타,비제조업,62_63,IT and Information Services,3
63111,자료 처리업,Data processing,기타,비제조업,62_63,IT and Information Services,4
63112,호스팅 및 관련 서비스업,Hosting and related service activities,기타,비제조업,62_63,IT and Information Services,4
6312,포털 및 기타 인터넷 정보매개 서비스업,Portals and other internet information media service activities,기타,비제조업,62_63,IT and Information Services,3
63120,포털 및 기타 인터넷 정보매개 서비스업,Portals and other internet information media service activities,기타,비제조업,62_63,IT and Information Services,4
