업종코드,업종한글명,업종영문명,"국내업체업종
세그먼트코드","국외업체업종
세그먼트코드","SRR
업종코드","SRR
업종명",계층구분
2422,"비철금속 압연, 압출 및 연신제품 제조업","Manufacture of non-ferrous metal products by rolling, extrusion and drawing",중공업,중공업,24B,Nonferrous Metals,3
24221,"동 압연, 압출 및 연신제품 제조업","Manufacture of copper products by rolling, extrusion and drawing",중공업,중공업,24B,Nonferrous Metals,4
24222,"알루미늄 압연, 압출 및 연신제품 제조업","Manufacture of aluminum products by rolling, extrusion and drawing",중공업,중공업,24B,Nonferrous Metals,4
24229,"기타 비철금속 압연, 압출 및 연신 제품 제조업","Manufacture of other non-ferrous metal products by rolling, extrusion and drawing",중공업,중공업,24B,Nonferrous Metals,4
2429,기타 1차 비철금속 제조업,Manufacture of other basic precious and non-ferrous metals,중공업,중공업,24B,Nonferrous Metals,3
24290,기타 1차 비철금속 제조업,Manufacture of other basic precious and non-ferrous metals,중공업,중공업,24B,Nonferrous Metals,4
243,금속 주조업,Casting of metals,중공업,중공업,24A,Iron and Steel,2
2431,철강 주조업,Casting of iron and steel,중공업,중공업,24A,Iron and Steel,3
24311,선철주물 주조업,Casting of pig iron,중공업,중공업,24A,Iron and Steel,4
24312,강주물 주조업,Casting of steel,중공업,중공업,24A,Iron and Steel,4
2432,비철금속 주조업,Casting of non-ferrous metals,중공업,중공업,24B,Nonferrous Metals,3
24321,알루미늄주물 주조업,Casting of aluminum,중공업,중공업,24B,Nonferrous Metals,4
24329,기타 비철금속 주조업,Casting of other non-ferrous metals,중공업,중공업,24B,Nonferrous Metals,4
25,금속가공제품 제조업; 기계 및 가구 제외,"Manufacture of fabricated metal products, except machinery and furniture",중공업,중공업,25,"Manufacture of Fabricated Metal Products, except Machinery and Equipment",1
251,"구조용 금속제품, 탱크 및 증기발생기 제조업","Manufacture of structural metal products, tanks, reservoirs and steam generators",중공업,중공업,251,"Manufacture of Structural Metal Products, Tanks, Reservoirs and Steam Generators",2
2511,구조용 금속제품 제조업,Manufacture of structural metal products,중공업,중공업,251,"Manufacture of Structural Metal Products, Tanks, Reservoirs and Steam Generators",3
25111,"금속 문, 창, 셔터 및 관련제품 제조업","Manufacture of metal doors, windows, shutters and related products",중공업,중공업,251,"Manufacture of Structural Metal Products, Tanks, Reservoirs and Steam Generators",4
25112,구조용 금속 판제품 및 공작물 제조업,Manufacture of structural metal sheet products and metal works used on building,중공업,중공업,251,"Manufacture of Structural Metal Products, Tanks, Reservoirs and Steam Generators",4
25113,육상 금속 골조 구조재 제조업,Manufacture of metal frameworks or skeletons for land structure and parts thereof ,중공업,중공업,251,"Manufacture of Structural Metal Products, Tanks, Reservoirs and Steam Generators",4
25114,수상 금속 골조 구조재 제조업,Manufacture of metal frameworks or skeletons for marine structure and parts thereof ,중공업,중공업,251,"Manufacture of Structural Metal Products, Tanks, Reservoirs and Steam Generators",4
25119,기타 구조용 금속제품 제조업,Manufacture of other structural metal products,중공업,중공업,251,"Manufacture of Structural Metal Products, Tanks, Reservoirs and Steam Generators",4
2512,"산업용 난방보일러, 금속탱크 및 유사 용기 제조업","Manufacture of industrial heating boilers, tanks, reservoirs and containers of metals",중공업,중공업,251,"Manufacture of Structural Metal Products, Tanks, Reservoirs and Steam Generators",3
25121,산업용 난방보일러 및 방열기 제조업,Manufacture of industrial heating boilers and radiators,중공업,중공업,251,"Manufacture of Structural Metal Products, Tanks, Reservoirs and Steam Generators",4
25122,금속탱크 및 저장용기 제조업,Manufacture of tanks and reservoirs,중공업,중공업,251,"Manufacture of Structural Metal Products, Tanks, Reservoirs and Steam Generators",4
25123,압축 및 액화 가스용기 제조업,Manufacture of of metal containers for compressed or liquefied gas,중공업,중공업,251,"Manufacture of Structural Metal Products, Tanks, Reservoirs and Steam Generators",4
2513,핵반응기 및 증기 보일러 제조업,Manufacture of nuclear reactors and steam generators,중공업,중공업,251,"Manufacture of Structural Metal Products, Tanks, Reservoirs and Steam Generators",3
25130,핵반응기 및 증기 보일러 제조업,Manufacture of nuclear reactors and steam generators,중공업,중공업,251,"Manufacture of Structural Metal Products, Tanks, Reservoirs and Steam Generators",4
252,무기 및 총포탄 제조업,Manufacture of weapons and ammunition,중공업,중공업,252,Manufacture of Weapons and Ammunition,2
2520,무기 및 총포탄 제조업,Manufacture of weapons and ammunition,중공업,중공업,252,Manufacture of Weapons and Ammunition,3
25200,무기 및 총포탄 제조업,Manufacture of weapons and ammunition,중공업,중공업,252,Manufacture of Weapons and Ammunition,4
259,기타 금속 가공제품 제조업,Manufacture of other fabricated metal products; metalworking service activities,중공업,중공업,259,"Manufacture of Other Fabricated Metal Products, Metalworking Service Activities",2
2591,"금속 단조, 압형 및 분말야금 제품 제조업","Forging, pressing, stamping and roll-forming of metal; powder metallurgy",중공업,중공업,259,"Manufacture of Other Fabricated Metal Products, Metalworking Service Activities",3
25911,분말 야금제품 제조업,Manufacture of powder metallurgic products,중공업,중공업,259,"Manufacture of Other Fabricated Metal Products, Metalworking Service Activities",4
25912,금속 단조제품 제조업,Manufacture of forging products,중공업,중공업,259,"Manufacture of Other Fabricated Metal Products, Metalworking Service Activities",4
25913,자동차용 금속 압형제품 제조업,Manufacture of pressing products for motor vehicles,중공업,중공업,259,"Manufacture of Other Fabricated Metal Products, Metalworking Service Activities",4
25914,그 외 금속 압형제품 제조업,Manufacture of other pressing products,중공업,중공업,259,"Manufacture of Other Fabricated Metal Products, Metalworking Service Activities",4
2592,"금속 열처리, 도금 및 기타 금속가공업",Treatment and coating of metals; machining,중공업,중공업,259,"Manufacture of Other Fabricated Metal Products, Metalworking Service Activities",3
25921,금속 열처리업,Heat treatment of metals,중공업,중공업,259,"Manufacture of Other Fabricated Metal Products, Metalworking Service Activities",4
25922,도금업,Plating of metals,중공업,중공업,259,"Manufacture of Other Fabricated Metal Products, Metalworking Service Activities",4
25923,도장 및 기타 피막처리업,Coating and similar treatment of metals,중공업,중공업,259,"Manufacture of Other Fabricated Metal Products, Metalworking Service Activities",4
25924,절삭가공 및 유사처리업,"Engraving, cutting and similar processing of metals",중공업,중공업,259,"Manufacture of Other Fabricated Metal Products, Metalworking Service Activities",4
25929,그 외 기타 금속가공업,Other metalworking n.e.c.,중공업,중공업,259,"Manufacture of Other Fabricated Metal Products, Metalworking Service Activities",4
2593,"날붙이, 수공구 및 일반철물 제조업","Manufacture of cutlery, hand tools and general hardware",중공업,중공업,259,"Manufacture of Other Fabricated Metal Products, Metalworking Service Activities",3
25931,날붙이 제조업,Manufacture of cutlery,중공업,중공업,259,"Manufacture of Other Fabricated Metal Products, Metalworking Service Activities",4
25932,일반철물 제조업,Manufacture of general hardware,중공업,중공업,259,"Manufacture of Other Fabricated Metal Products, Metalworking Service Activities",4
25933,비동력식 수공구 제조업,Manufacture of non-power-driven hand tools ,중공업,중공업,259,"Manufacture of Other Fabricated Metal Products, Metalworking Service Activities",4
25934,톱 및 호환성 공구 제조업,"Manufacture of saws, saw blades and interchangeable tools",중공업,중공업,259,"Manufacture of Other Fabricated Metal Products, Metalworking Service Activities",4
2594,"금속파스너, 스프링 및 금속선 가공제품 제조업","Manufacture of metal fasteners, springs and articles made of metal wires",중공업,중공업,259,"Manufacture of Other Fabricated Metal Products, Metalworking Service Activities",3
25941,볼트 및 너트류 제조업,Manufacture of bolts and screws,중공업,중공업,259,"Manufacture of Other Fabricated Metal Products, Metalworking Service Activities",4
25942,그 외 금속파스너 및 나사제품 제조업,Manufacture of other metal fasteners and screw products,중공업,중공업,259,"Manufacture of Other Fabricated Metal Products, Metalworking Service Activities",4
25943,금속 스프링 제조업,Manufacture of metal springs,중공업,중공업,259,"Manufacture of Other Fabricated Metal Products, Metalworking Service Activities",4
25944,금속선 가공제품 제조업,Manufacture of articles made of metal wires,중공업,중공업,259,"Manufacture of Other Fabricated Metal Products, Metalworking Service Activities",4
2599,그 외 기타 금속가공제품 제조업,Manufacture of other fabricated metal products,중공업,중공업,259,"Manufacture of Other Fabricated Metal Products, Metalworking Service Activities",3
25991,금속 캔 및 기타 포장용기 제조업,Manufacture of metal cans and other containers,중공업,중공업,259,"Manufacture of Other Fabricated Metal Products, Metalworking Service Activities",4
25992,수동식 식품 가공기기 및 금속 주방용기 제조업,Manufacture of hand-operated kitchen appliances and metal ware,중공업,중공업,259,"Manufacture of Other Fabricated Metal Products, Metalworking Service Activities",4
25993,금속 위생용품 제조업,Manufacture of metal sanitary ware,중공업,중공업,259,"Manufacture of Other Fabricated Metal Products, Metalworking Service Activities",4
25994,금속 표시판 제조업,Manufacture of metal sign boards including road signs,중공업,중공업,259,"Manufacture of Other Fabricated Metal Products, Metalworking Service Activities",4
25995,피복 및 충전 용접봉 제조업,"Manufacture of coated rods and cored wire, of base metal for soldering or welding",중공업,중공업,259,"Manufacture of Other Fabricated Metal Products, Metalworking Service Activities",4
25999,그 외 기타 분류 안된 금속 가공 제품 제조업,Manufacture of other febricated and processed metal products n.e.c,중공업,중공업,259,"Manufacture of Other Fabricated Metal Products, Metalworking Service Activities",4
26,"전자부품, 컴퓨터, 영상, 음향 및 통신장비 제조업","Manufacture of electronic components, computer; visual, sounding and communication equipment",중공업,중공업,261,Manufacture of Electronic Components and Boards,1
261,반도체 제조업,Manufacture of semiconductor,중공업,중공업,261,Manufacture of Electronic Components and Boards,2
2611,전자집적회로 제조업,Manufacture of electronic integrated circuits,중공업,중공업,261,Manufacture of Electronic Components and Boards,3
26111,메모리용 전자집적회로 제조업,Manufacture of memory electronic integrated circuits,중공업,중공업,261,Manufacture of Electronic Components and Boards,4
26112,비메모리용 및 기타 전자집적회로 제조업,Manufacture of non-memory electronic integrated circuits,중공업,중공업,261,Manufacture of Electronic Components and Boards,4
2612,"다이오드, 트랜지스터 및 유사 반도체소자 제조업","Manufacture of diodes, transistors and similar semi-conductor devices",중공업,중공업,261,Manufacture of Electronic Components and Boards,3
26121,발광 다이오드 제조업,Manufacture of light emitting diodes,중공업,중공업,261,Manufacture of Electronic Components and Boards,4
26129,기타 반도체소자 제조업,"Manufacture of other diodes, transistors and similar semi-conductor devices",중공업,중공업,261,Manufacture of Electronic Components and Boards,4
262,전자부품 제조업,Manufacture of electronic components,중공업,중공업,261,Manufacture of Electronic Components and Boards,2
2621,표시장치 제조업,Manufacture of flat display components,중공업,중공업,261,Manufacture of Electronic Components and Boards,3
26211,액정 표시장치 제조업,Manufacture of liquid crystal display components,중공업,중공업,261,Manufacture of Electronic Components and Boards,4
26212,유기발광 표시장치 제조업,Manufacture of organic light emitting diodes display components,중공업,중공업,261,Manufacture of Electronic Components and Boards,4
26219,기타 표시장치 제조업,Manufacture of other display component,중공업,중공업,261,Manufacture of Electronic Components and Boards,4
2622,인쇄회로기판 및 전자부품 실장기판 제조업,Manufacture of bare printed circuit boards and loading of electronic components onto pcb ,중공업,중공업,261,Manufacture of Electronic Components and Boards,3
26221,인쇄회로기판용 적층판 제조업,Manufacture of laminated plates for printed circuit boards,중공업,중공업,261,Manufacture of Electronic Components and Boards,4
26222,경성 인쇄회로기판 제조업,Manufacture of rigid printed circuit boards,중공업,중공업,261,Manufacture of Electronic Components and Boards,4
26223,연성 및 기타 인쇄회로기판 제조업,Manufacture of flexible and other printed circuit boards,중공업,중공업,261,Manufacture of Electronic Components and Boards,4
26224,전자부품 실장기판 제조업,Manufacture of loading of electronic components onto PCB ,중공업,중공업,261,Manufacture of Electronic Components and Boards,4
2629,기타 전자부품 제조업,"Manufacture of other electronic components, except semiconductor and electronic integrated circuits",중공업,중공업,261,Manufacture of Electronic Components and Boards,3
26291,전자축전기 제조업,Manufacture of electronic capacitors,중공업,중공업,261,Manufacture of Electronic Components and Boards,4
26292,전자저항기 및 전자카드 제조업,Manufacture of electronic resistors and smart cards with magnetic stripe or chip,중공업,중공업,261,Manufacture of Electronic Components and Boards,4
26293,"전자코일, 변성기 및 기타 전자 유도자 제조업","Manufacture of electronic coils, transformers and other inductors",중공업,중공업,261,Manufacture of Electronic Components and Boards,4
26294,전자감지장치 제조업,Manufacture of electronic perception sensors,중공업,중공업,261,Manufacture of Electronic Components and Boards,4
26299,그 외 기타 전자부품 제조업,"Manufacture of electronic tubes, interface cards and other electronic components n.e.c.",중공업,중공업,261,Manufacture of Electronic Components and Boards,4
263,컴퓨터 및 주변장치 제조업,Manufacture of computers and peripheral equipment,중공업,중공업,262,Manufacture of Computersand Peripheral Equipment ,2
2631,컴퓨터 제조업,Manufacture of computer,중공업,중공업,262,Manufacture of Computersand Peripheral Equipment ,3
26310,컴퓨터 제조업,Manufacture of computer,중공업,중공업,262,Manufacture of Computersand Peripheral Equipment ,4
2632,기억장치 및 주변기기 제조업,Manufacture of storage devices and peripheral equipment,중공업,중공업,262,Manufacture of Computersand Peripheral Equipment ,3
26321,기억장치 제조업,Manufacture of storage devices,중공업,중공업,262,Manufacture of Computersand Peripheral Equipment ,4
26322,컴퓨터 모니터 제조업,Manufacture of computer monitor,중공업,중공업,262,Manufacture of Computersand Peripheral Equipment ,4
26323,컴퓨터 프린터 제조업,Manufacture of computer printer,중공업,중공업,262,Manufacture of Computersand Peripheral Equipment ,4
26329,기타 주변기기 제조업,Manufacture of other peripheral apparatuses,중공업,중공업,262,Manufacture of Computersand Peripheral Equipment ,4
264,통신 및 방송 장비 제조업,Manufacture of communication and broadcasting apparatuses ,중공업,중공업,263,Manufacture of Communication Equipment,2
2641,유선 통신장비 제조업,Manufacture of wire communication apparatuses,중공업,중공업,263,Manufacture of Communication Equipment,3
26410,유선 통신장비 제조업,Manufacture of wire telecommunication apparatuses,중공업,중공업,263,Manufacture of Communication Equipment,4
2642,방송 및 무선 통신장비 제조업,Manufacture of broadcasting and wireless communication apparatuses,중공업,중공업,263,Manufacture of Communication Equipment,3
26421,방송장비 제조업,Manufacture of broadcasting apparatuses,중공업,중공업,263,Manufacture of Communication Equipment,4
26422,이동전화기 제조업,Manufacture of mobile phone,중공업,중공업,263,Manufacture of Communication Equipment,4
26429,기타 무선 통신장비 제조업,Manufacture of other wireless communication apparatuses,중공업,중공업,263,Manufacture of Communication Equipment,4
265,영상 및 음향기기 제조업,Manufacture of electronic video and audio equipment,중공업,중공업,264,Manufacture of Consumer Electronics,2
2651,"텔레비전, 비디오 및 기타 영상기기 제조업","Manufacture of television, video and other visual equipment",중공업,중공업,264,Manufacture of Consumer Electronics,3
26511,텔레비전 제조업,Manufacture of television,중공업,중공업,264,Manufacture of Consumer Electronics,4
26519,비디오 및 기타 영상기기 제조업,Manufacture of video and other visual equipment,중공업,중공업,264,Manufacture of Consumer Electronics,4
2652,"오디오, 스피커 및 기타 음향기기 제조업","Manufacture of audio, speaker and other sounding equipment",중공업,중공업,264,Manufacture of Consumer Electronics,3
26521,"라디오, 녹음 및 재생 기기 제조업","Manufacture of radio, recorder and reproducing apparatuses",중공업,중공업,264,Manufacture of Consumer Electronics,4
26529,기타 음향기기 제조업,Manufacture of other sounding equipment,중공업,중공업,264,Manufacture of Consumer Electronics,4
266,마그네틱 및 광학 매체 제조업,Manufacture of magnetic and optical medium,중공업,중공업,267_8,Optical and Photographic,2
2660,마그네틱 및 광학 매체 제조업,Manufacture of magnetic and optical medium,중공업,중공업,267_8,Optical and Photographic,3
26600,마그네틱 및 광학 매체 제조업,Manufacture of magnetic and optical medium,중공업,중공업,267_8,Optical and Photographic,4
27,"의료, 정밀, 광학기기 및 시계 제조업","Manufacture of medical, precision and optical instruments, watches and clocks",중공업,중공업,32,Other Manufacturing,1
271,의료용 기기 제조업,Manufacture of medical and dental instruments and supplies,중공업,중공업,32,Other Manufacturing,2
2711,방사선 장치 및 전기식 진단 기기 제조업,Manufacture of irradiation and electro-diagnostic apparatuses,중공업,중공업,266,"Manufacture of Irradiation, Electromedical and Electrotherapeutic Equipment",3
27111,방사선 장치 제조업,Manufacture of irradiation apparatuses,중공업,중공업,266,"Manufacture of Irradiation, Electromedical and Electrotherapeutic Equipment",4
27112,전기식 진단 및 요법 기기 제조업,Manufacture of electro-diagnostic and electro-therapeutic apparatuses,중공업,중공업,266,"Manufacture of Irradiation, Electromedical and Electrotherapeutic Equipment",4
2719,기타 의료용 기기 제조업,Manufacture of other medical and surgical equipment and orthopedic appliances,중공업,중공업,32,Other Manufacturing,3
27191,치과용 기기 제조업,Manufacture of dental instruments and appliances,중공업,중공업,32,Other Manufacturing,4
27192,치과기공물 제조업,Manufacture of dental prosthesis,중공업,중공업,32,Other Manufacturing,4
27193,치과용 임플란트 제조업,Manufacture of dental implant,중공업,중공업,32,Other Manufacturing,4
27194,정형외과용 및 신체 보정용 기기 제조업,"Manufacture of orthopedic, orthodontic, prosthetic appliances and supplies for disability",중공업,중공업,32,Other Manufacturing,4
27195,안경 및 안경렌즈 제조업,Manufacture of eyeglasses and optical lenses,중공업,중공업,32,Other Manufacturing,4
27196,의료용 가구 제조업,"Manufacture of medical, surgical, dental or veterinary furniture",중공업,중공업,32,Other Manufacturing,4
27199,그 외 기타 의료용 기기 제조업,Manufacture of other medical and surgical equipment and orthopedic appliances n.e.c.,중공업,중공업,32,Other Manufacturing,4
272,"측정, 시험, 항해, 제어 및 기타 정밀기기 제조업; 광학기기 제외","Manufacture of measuring, testing, navigating and control equipment; except optical instruments",중공업,중공업,2651,"Manufacture of Measuring, Testing, Navigating and Control Equipment",2
2721,"측정, 시험, 항해, 제어 및 기타 정밀기기 제조업","Manufacture of measuring, testing, navigating, control and other precision instrumensts ",중공업,중공업,2651,"Manufacture of Measuring, Testing, Navigating and Control Equipment",3
27211,"레이더, 항행용 무선기기 및 측량기구 제조업","Manufacture of radar, navigation, aeronautical, nautical equipment; measuring and recording equipment",중공업,중공업,2651,"Manufacture of Measuring, Testing, Navigating and Control Equipment",4
27212,"전자기 측정, 시험 및 분석기구 제조업",Manufacture of instruments for measuring and testing electricity and electrical signals,중공업,중공업,2651,"Manufacture of Measuring, Testing, Navigating and Control Equipment",4
27213,"물질 검사, 측정 및 분석기구 제조업","Manufacture of physical properties testing, measuring and inspection equipment",중공업,중공업,2651,"Manufacture of Measuring, Testing, Navigating and Control Equipment",4
27214,속도계 및 적산계기 제조업,Manufacture of speedometers and integrating meters,중공업,중공업,2651,"Manufacture of Measuring, Testing, Navigating and Control Equipment",4
27215,기기용 자동측정 및 제어장치 제조업,Manufacture of environmental controls and automatic controls for appliances,중공업,중공업,2651,"Manufacture of Measuring, Testing, Navigating and Control Equipment",4
27216,산업처리공정 제어장비 제조업,Manufacture of industrial process control equipment,중공업,중공업,2651,"Manufacture of Measuring, Testing, Navigating and Control Equipment",4
27219,"기타 측정, 시험, 항해, 제어 및 정밀기기 제조업","Manufacture of other measuring, testing, navigating, control instrumensts n.e.c. ",중공업,중공업,2651,"Manufacture of Measuring, Testing, Navigating and Control Equipment",4
2722,시계 및 시계부품 제조업,"Manufacture of watches, clocks and its parts",중공업,중공업,2652,Manufacture of Watches and Clocks,3
27220,시계 및 시계부품 제조업,"Manufacture of watches, clocks and its parts",중공업,중공업,2652,Manufacture of Watches and Clocks,4
273,사진장비 및 광학기기 제조업,Manufacture of photographic equipment and optical instruments,중공업,중공업,267_8,Optical and Photographic,2
2730,사진장비 및 광학기기 제조업,Manufacture of photographic equipment and optical instruments,중공업,중공업,267_8,Optical and Photographic,3
27301,광학렌즈 및 광학요소 제조업,Manufacture of optical lens and elements,중공업,중공업,267_8,Optical and Photographic,4
27309,기타 광학기기 및 사진기 제조업,"Manufacture of cameras, other optical instruments and photographic equipment",중공업,중공업,2029,Manufacture of Other Chemical Products N.E.C.,4
28,전기장비 제조업,Manufacture of electrical equipment,중공업,중공업,27,Manufacture of Electrical Equipment,1
281,"전동기, 발전기 및 전기 변환ㆍ 공급ㆍ제어 장치 제조업","Manufacture of electric motors, generators, transformers and electricity distribution and control apparatus",중공업,중공업,271,"Manufacture of Electric Motors, Generators, Transformers and Electricity Distribution and Control Apparatus",2
2811,"전동기, 발전기 및 전기 변환장치 제조업","Manufacture of electric motors, generators and transformers",중공업,중공업,271,"Manufacture of Electric Motors, Generators, Transformers and Electricity Distribution and Control Apparatus",3
28111,전동기 및 발전기 제조업,Manufacture of electric motors and generators,중공업,중공업,271,"Manufacture of Electric Motors, Generators, Transformers and Electricity Distribution and Control Apparatus",4
28112,변압기 제조업,Manufacture of transformers,중공업,중공업,271,"Manufacture of Electric Motors, Generators, Transformers and Electricity Distribution and Control Apparatus",4
28113,에너지 저장장치 제조업,Manufacture of energy storage system,중공업,중공업,271,"Manufacture of Electric Motors, Generators, Transformers and Electricity Distribution and Control Apparatus",4
